title	count
"""Food for Free"" programme (debate)"	102
100th anniversary of International Women’s Day	26
10th anniversary of 11 September 2001	2
16th session of the United Nations Human Rights Council (Geneva, 28 February - 25 March 2011) (B7-0158/2011 ) (vote)	14
16th session of the United Nations Human Rights Council (Geneva, 28 February - 25 March 2011) (debate)	66
2009 discharge (continuation of debate)	78
2009 discharge (debate)	56
2009 discharge: Council (A7-0328/2011 - Crescenzio Rivellini) (vote)	6
2009 discharge: Council (debate)	50
2009 discharge: EU general budget - European Parliament (A7-0094/2011 , Ville Itälä) (vote)	6
2010 progress report on Croatia (B7-0094/2011 ) (vote)	6
2010 progress report on Croatia (debate)	80
2010 progress report on Iceland	50
2010 progress report on Iceland (B7-0226/2011 ) (vote)	12
2010 progress report on Turkey (B7-0156/2011 ) (vote)	8
2010 progress report on Turkey (debate)	118
2010 progress report on the former Yugoslav Republic of Macedonia	60
2010 progress report on the former Yugoslav Republic of Macedonia (B7-0225/2011 ) (vote)	20
2012 budgetary procedure: joint text (debate)	84
2012 draft budget trilogue (A7-0230/2011 - Francesca Balzani)	6
2012 draft budget trilogue (debate)	72
5th cohesion report and strategy for the post-2013 cohesion policy (A7-0222/2011 - Markus Pieper) (vote)	14
5th cohesion report and strategy for the post-2013 cohesion policy - Implementation of cohesion policy programmes for 2007-2013 - European urban agenda and its future in cohesion policy - Objective 3: future agenda for cross-border, transnational and interregional cooperation - Increased effectiveness between ERDF and other structural funds (continuation of debate)	28
5th cohesion report and strategy for the post-2013 cohesion policy - Implementation of cohesion policy programmes for 2007-2013 - European urban agenda and its future in cohesion policy - Objective 3: future agenda for cross-border, transnational and interregional cooperation - Increased effectiveness between ERDF and other structural funds (debate)	128
A comprehensive approach to non-CO2 climate-relevant anthropogenic emissions (B7-0474/2011 ) (vote)	16
A comprehensive approach to non-CO2 climate-relevant anthropogenic emissions (debate)	40
A more efficient and fairer retail market (short presentation)	14
A new Multiannual Financial Framework (MFF) for a competitive, sustainable and inclusive Europe (A7-0193/2011 - Salvador Garriga Polledo) (vote)	2
A new Multiannual Financial Framework (MFF) for a competitive, sustainable and inclusive Europe (continuation of debate)	158
A new Multiannual Financial Framework (MFF) for a competitive, sustainable and inclusive Europe (debate)	86
A sustainable EU policy for the High North (debate)	76
ACP-EU Joint Parliamentary Assembly in 2010 (debate)	40
Accession Treaty : Treaty concerning the accession of the Republic of Croatia - Application of Croatia to become a member of the European Union (debate)	116
Accession Treaty: Treaty concerning the accession of the Republic of Croatia (A7-0390/2011 - Hannes Swoboda)	4
Accession of Bulgaria and Romania to Schengen (B7-0532/2011 )	2
Accession of Bulgaria and Romania to Schengen (debate)	148
Accountability report on financing for development (debate)	40
Activities of the Committee on Petitions 2010 (debate)	40
Address by Bronisław Komorowski, President of the Republic of Poland	6
Address by the President, Jerzy Buzek, on his term of office	2
Adequate, sustainable and safe European pension systems (debate)	112
Adjournment of the session	28
Adoption of modifications to the Treaty (debate)	50
Agency for the management of large-scale IT systems in the area of freedom, security and justice (debate)	46
Agenda	2
Agenda for new skills and jobs (debate)	118
Agreements on trade in bananas - Repeal of Council Regulation (EC) No 1964/2005 on the tariff rates for bananas - Agreements on trade in bananas (debate)	54
Agriculture and international trade (short presentation)	32
Agriculture as a strategic sector in the context of food security (A7-0376/2010 , Daciana Octavia Sârbu) (vote)	2
Agriculture as a strategic sector in the context of food security (short presentation)	54
Alternative dispute resolution in civil, commercial and family matters (short presentation)	22
Amendment of Council Regulation (EC) No 55/2008 introducing autonomous trade preferences for the Republic of Moldova (A7-0041/2011 , Vital Moreira) (vote)	8
Amendment of the Rules following the establishment of a common Transparency Register (A7-0173/2011 , Carlo Casini) (vote)	2
Amendment of the Treaty on the Functioning of the European Union with regard to a stability mechanism for Member States whose currency is the euro (A7-0052/2011 , Elmar Brok) (vote)	8
Amendment of the Treaty on the Functioning of the European Union with regard to a stability mechanism for Member States whose currency is the euro (debate)	98
Amendment to Rules of Procedure regarding code of conduct for Members of the European Parliament in respect of financial interests and conflicts of interest (A7-0386/2011 - Carlo Casini)	14
American Jobs Act (debate)	58
An EU Strategy for the Black Sea (A7-0378/2010 , Traian Ungureanu) (vote)	6
An EU Strategy for the Black Sea (debate)	74
An effective raw materials strategy for Europe (debate)	92
Announcement by the President	6
Announcements by the President	2
Annual report from the Council to Parliament on the main aspects and basic choices of the common foreign and security policy (CFSP) in 2009 (A7-0168/2011 , Gabriele Albertini) (vote)	36
Annual report on monitoring the application of EU law (2009) - Better legislation, subsidiarity and proportionality and smart regulation - Public access to documents 2009-2010 (debate)	96
Antibiotic resistance (debate)	40
Application of EIA Directive in Austria (debate)	50
Application of Schengen acquis in Bulgaria and Romania (debate)	126
Appointment of the Chairperson of the European Supervisory Authority (European Banking Authority)	16
Appointment of the Chairperson of the European Supervisory Authority (European Securities and Markets Authority)	10
Appointment of the executive director of the European Banking Authority (EBA) (B7-0222/2011 ) (vote)	4
Appointments of ESA senior executives (debate)	28
Approach of the European Parliament to implementing Articles 9 and 10 of Protocol 1 of the Lisbon Treaty on parliamentary cooperation in the field of CFSP/CSDP (debate)	20
Approval of the Minutes of the previous sitting	4
Approval of the minutes of the previous sitting	2
Approval of the minutes of the previous sitting : see Minutes	2
Assisting developing countries in addressing food security challenges (short presentation)	28
Audit policy - lessons from the crisis (short presentation)	20
Authorisation and refusal of authorisation of certain health claims made on foods and referring to children's development and health (B7-0227/2011 ) (vote)	6
Aviation security with a special focus on security scanners (A7-0216/2011 - Luis de Grandes Pascual) (vote)	6
Aviation security with a special focus on security scanners - Liquids (LAG) ban on aircrafts (debate)	66
Award of the Sakharov Prize (formal sitting)	14
Azerbaijan (debate)	44
Azerbaijan, notably the case of Rafiq Tagi	34
Bahrain	54
Ban on the elections for the Tibetan government in exile in Nepal	42
Banning cluster munitions (debate)	18
Belarus (B7-0332/2011 )	2
Belarus (debate)	50
Belarus, in particular the cases of Ales Michalevic and Natalia Radin	42
Belarus: arrest of Ales Bialatski, human rights defender	62
Black Sea fisheries (short presentation)	20
Border clashes between Thailand and Cambodia	42
Brazil: extradition of Cesare Battisti	62
Budget support to developing countries (short presentation)	28
Budgetary control of EU financial assistance to Afghanistan (short presentation)	20
Budgetary surveillance in euro area (A7-0180/2011 - Sylvie Goulard) (vote)	4
Changes to Schengen (debate)	84
Charging of heavy goods vehicles (debate)	96
Civilian invalids of war (written declaration)	4
Cleanup in Europe and Let's do it World 2012 (written declaration)	6
Climate change conference in Durban (debate)	92
Closing of the session	2
Closing the gap between anti-corruption law and reality (B7-0481/2011 ) (vote)	10
Closing the gap between anti-corruption law and reality (debate)	80
Closure of the accounts of the European Police College for the financial year 2008	4
Closure of the sitting	68
Combating corruption in European Sport – The work of the Committee on Missing Persons in Cyprus (written declarations)	8
Combating illegal fishing at the global level (A7-0362/2011 - Isabella Lövin) (vote)	6
Combating illegal fishing at the global level (debate)	62
Commemoration of deportations in 1941 in the Baltic States	14
Commission expert groups and balanced representation and transparency (debate)	36
Commission work programme for 2012 (debate)	116
Common security and defence policy (Article 36 TEU) - Impact of the financial crisis on the defence sector (debate)	94
Composition of Parliament	36
Composition of committees and delegations : see Minutes	6
Composition of committees and delegations: see Minutes	6
Conclusions of the European Council meeting (23 October 2011) (debate)	116
Conclusions of the European Council meeting (24-25 March 2011) (debate)	178
Conclusions of the European Council meeting (8-9 December 2011) (debate)	218
Conclusions of the European Council meeting on 16-17 December (debate)	68
Consequences in the European Union of the dioxin animal feed incident (debate)	76
Consumer policy (short presentation)	22
Consumer rights (A7-0038/2011 , Andreas Schwab) (vote)	14
Consumer rights (debate)	102
Consumer rights (final vote) (A7-0038/2011 - Andreas Schwab)	16
Cooperating with developing countries on promoting good governance in tax matters (short presentation)	14
Cooperation in vocational education and training to support the Europe 2020 strategy (A7-0082/2011 - Nadja Hirsch) (vote)	6
Cooperation in vocational education and training to support the Europe 2020 strategy (short presentation)	28
Cord blood stem cells (debate)	32
Corrections to votes and voting intentions: see Minutes	66
Corrigendum (Rule 216)	6
Corrigendum to a text adopted: see Minutes	6
Cost of examining asylum seekers’ applications in Member States (debate)	50
Credit rating agencies (short presentation)	22
Cross-border exchange of information on road safety related traffic offences	70
Cross-border exchange of information on road safety-related traffic offences (A7-0208/2011 - Inés Ayala Sender) (vote)	6
Current developments in Ukraine (debate)	62
Dam infrastructure in developing countries (short presentation)	14
Decision on urgent procedure	12
Defence of the parliamentary immunity of Mr Bruno Gollnisch (A7-0154/2011 , Bernhard Rapkay) (vote)	10
Defence of the parliamentary immunity of Mr Luigi de Magistris (A7-0152/2011 , Bernhard Rapkay) (vote)	6
Democratic Republic of Congo, mass rape in South Kivu province (B7-0442/2011 )	56
Demographic change and its consequences for the cohesion policy (short presentation)	32
Derivatives, central counterparties and trade repositories (A7-0223/2011 - Werner Langen) (vote)	6
Derivatives, central counterparties and trade repositories (debate)	52
Detention conditions in the EU (B7-0687/2011 ) (vote)	10
Detention conditions in the EU (debate)	62
Development of the common security and defence policy following the entry into force of the Lisbon Treaty (A7-0166/2011 , Roberto Gualtieri) (vote)	10
Developments in the ongoing debt crisis and the EU response (debate)	110
Directive on mediation in the Member States (debate)	34
Documents received: see Minutes	2
Dog population management in the European Union (written declaration)	4
Draft amending budget No 2 /2011: flooding in Slovenia, Croatia and the Czech Republic in September 2010 (A7-0233/2011 - Sidonia Elżbieta Jędrzejewska) (vote)	4
Draft amending budget No 4/2011: own resources and migration and refugee flows (A7-0312/2011 - Sidonia Elżbieta Jędrzejewska) (vote)	4
Draft amending budget No 5/2011 - Section IX – European Data Protection Supervisor. Section X – European External Action Service (A7-0346/2011 - Helga Trüpel) (vote)	4
Draft amending budget No 6/2011: Own resources, Integrated Maritime Policy, Greece, ESF, Palestine (A7-0407/2011 - Sidonia Elżbieta Jędrzejewska)	2
Draft general budget of the European Union - 2012 financial year (vote)	20
Draft scoreboard for the surveillance of macro-economic imbalances (debate)	32
Dual-use items and technology (A7-0028/2011 , Jörg Leichtfried) (vote)	6
Dual-use items and technology (A7-0028/2011 - Jörg Leichtfried) (vote)	4
Dual-use items and technology (debate)	34
EC-Comoros fisheries agreement - Community financial measures for the implementation of the common fisheries policy and in the area of the Law of the Sea - Fisheries - transitional technical measures - Imports from Greenland of fishery products (debate)	68
EC-Serbia Stabilisation and Association Agreement - Stabilisation and Association Agreement between the EC and Serbia (continuation of debate)	84
EC-Serbia Stabilisation and Association Agreement - Stabilisation and Association Agreement between the EC and Serbia (debate)	10
EC-Uzbekistan partnership and cooperation agreement and bilateral trade in textiles (debate)	44
EC-West African Economic and Monetary Union air services agreement (A7-0361/2010 , Dieter-Lebrecht Koch) (vote)	4
ECB annual report for 2010 (debate)	80
EHEC outbreak in the EU Member States (debate)	116
EIB annual report for 2009 (A7-0073/2011 , George Sabin Cutaş) (vote)	2
EIB annual report for 2009 (debate)	76
EU approach towards Iran (A7-0037/2011 , Bastiaan Belder) (vote)	10
EU approach towards Iran (debate)	82
EU competition policy (A7-0424/2011 - Andreas Schwab) (vote)	8
EU competition policy (debate)	70
EU counter-terrorism policy: main achievements and future challenges (A7-0286/2011 - Sophia in ’t Veld) (vote)	8
EU counter-terrorism policy: main achievements and future challenges (short presentation)	40
EU external policies in favour of democratisation (debate)	46
EU framework for coordinating national Roma integration strategies (debate)	36
EU funding in the area of decommissioning nuclear power plants in the new Member States (short presentation)	22
EU global response to HIV/AIDS (B7-0615/2011 )	4
EU global response to HIV/AIDS (debate)	40
EU guarantee to the EIB against losses under loans and guarantees for projects outside the EU (A7-0019/2011 , Ivailo Kalfin) (vote)	6
EU guarantee to the EIB against losses under loans and guarantees for projects outside the EU (debate)	82
EU homelessness strategy (debate)	86
EU policy approach to the ITU World Radiocommunication Conference 2012 (B7-0480/2011 ) (vote)	2
EU policy approach to the ITU World Radiocommunication Conference 2012 (debate)	32
EU policy framework to fight violence against women (A7-0065/2011 , Eva-Britt Svensson) (vote)	2
EU policy framework to fight violence against women (debate)	92
EU position and commitment in advance of the UN high-level meeting on the prevention and control of non-communicable diseases (debate)	42
EU protein deficit (A7-0026/2011 , Martin Häusling) (vote)	8
EU protein deficit (short presentation)	34
EU recognition of the Roma genocide during World War II	30
EU relations with Mongolia (debate)	24
EU relations with the Gulf Cooperation Council (A7-0042/2011 , Dominique Baudis) (vote)	30
EU relations with the Gulf Cooperation Council (short presentation)	22
EU research and innovation funding (debate)	98
EU response to the migration flows in North Africa and the Southern Mediterranean, in particular, in Lampedusa - Migration flows arising from instability: scope and role of EU foreign policy (debate)	126
EU strategy for Central Asia (A7-0338/2011 - Nicole Kiil-Nielsen) (vote)	6
EU strategy for Central Asia (short presentation)	20
EU strategy for the Atlantic region (debate)	56
EU strategy on Roma inclusion (debate)	84
EU support for the International Criminal Court (A7-0368/2011 - Wolfgang Kreissl-Dörfler) (vote)	6
EU support for the International Criminal Court (short presentation)	14
EU support to refugees in Tunisia (debate)	56
EU tomato imports from Morocco (Petition 1565/2009) (debate)	38
EU-Australia agreement on the processing and transfer of PNR data (debate)	54
EU-Cameroon forest law agreement - EU-Republic of Congo forest law agreement - FLEGT voluntary partnership agreements (continuation of debate)	36
EU-Cameroon forest law agreement - EU-Republic of Congo forest law agreement - FLEGT voluntary partnership agreements (debate)	14
EU-Canada trade relations (B7-0344/2011 ) (vote)	6
EU-Canada trade relations (debate)	74
EU-Japan trade relations (debate)	40
EU-Japan trade relations (vote)	6
EU-Libya Framework Agreement	52
EU-Mauritania Fisheries Partnership Agreement (debate)	32
EU-Morocco Fisheries Partnership Agreement (A7-0394/2011 - Carl Haglund) (vote)	4
EU-Morocco fisheries partnership agreement - Future protocol setting out the fishing opportunities and financial compensation provided for in the Fisheries Partnership Agreement between the European Union and the Kingdom of Morocco (debate)	70
EU-Russia Summit (B7-0347/2011 ) (vote)	6
EU-Russia Summit (debate)	46
EU-Russia summit (debate)	94
EU-Taiwan trade (debate)	48
EU-US air transport agreement - EU-Canada air transport agreement - EU-Vietnam air services agreement (debate)	52
EU-US summit of 28 November 2011 (B7-0577/2011 ) (vote)	14
EU-US summit of 28 November 2011 (debate)	108
Eastern partnership summit (Warsaw, 29 September) (debate)	120
Eavesdropping scandal in Bulgaria (debate)	68
Economic crisis and the euro (debate)	164
Economic governance	154
Efficiency of the European agencies linked to employment, working conditions and training (debate)	44
Egypt, in particular the case of blogger Alaa Abd El-Fattah	58
Election of a Vice-President of the European Parliament (to replace Mr Lambrinidis) (vote)	6
Election of a Vice-President of the European Parliament (to replace Mrs Koch-Mehrin) (vote)	2
Emergency autonomous trade preferences for Pakistan (A7-0069/2011 , Vital Moreira) (vote)	12
Emergency autonomous trade preferences for Pakistan (debate)	62
Emission performance standards for new light commercial vehicles (debate)	94
Energy infrastructure priorities for 2020 and beyond (A7-0226/2011 - Francisco Sosa Wagner) (vote)	6
Energy infrastructure priorities for 2020 and beyond (short presentation)	38
Energy market integrity and transparency (debate)	74
Enforcement of consumer protection laws (A7-0201/2011 - Mitro Repo) (vote)	4
Enforcement of regulations on the shipping of toxic waste to developing countries (debate)	30
Enhanced cooperation in the area of the creation of unitary patent protection (debate)	68
Epilepsy (written declaration): see Minutes	4
Equality between women and men - 2010 (A7-0029/2011 , Mariya Nedelcheva) (vote)	6
Eritrea: case of Dawit Isaak	40
Establishment of Euro-Mediterranean Erasmus and Leonardo da Vinci programmes (written declaration)	4
Establishment of a European Voluntary Humanitarian Aid Corps (written declaration)	4
Establishment of a joint EU resettlement programme (debate)	92
Estimates of revenue and expenditure for 2012 - Section I - Parliament (A7-0087/2011 , José Manuel Fernandes) (vote)	4
Estimates of revenue and expenditure for 2012 - Section I - Parliament (debate)	78
Europe 2020 (B7-0097/2011 ) (vote)	6
European Agency for the Management of Operational Cooperation at the External Borders of the Member States of the European Union (FRONTEX) (debate)	112
European Arrest Warrant (debate)	104
European Consensus on humanitarian aid (short presentation)	20
European Heritage Label (debate)	64
European Maritime Safety Agency (debate)	60
European Neighbourhood Policy (debate)	104
European Schools system (short presentation)	28
European Semester 2011: first lessons (debate)	70
European Year for Active Ageing (2012) (A7-0061/2011 - Martin Kastler) (vote)	4
European cinema in the digital era (A7-0366/2011 - Piotr Borys) (vote)	6
European disaster response: role of civil protection and humanitarian assistance (debate)	78
European environmental economic accounts (debate)	58
European fisheries sector crisis due to rise in oil prices (debate)	66
European initiative on Alzheimer’s disease and other dementias - Asthma inhalers (debate)	90
European integration process of Montenegro (debate)	48
European international investment policy (short presentation)	14
European platform against poverty and social exclusion (A7-0370/2011 - Frédéric Daerden) (vote)	8
European platform against poverty and social exclusion (debate)	122
European protection order (A7-0435/2011 - Teresa Jiménez-Becerril Barrio, Carmen Romero López) (vote)	4
European protection order (debate)	66
European road safety (A7-0264/2011 - Dieter-Lebrecht Koch) (vote)	4
European road safety (short presentation)	34
European semester for economic policy coordination (debate)	92
European statistics on tourism (debate)	60
Exceptional trade measures for countries and territories participating in or linked to the EU’s Stabilisation and Association process (A7-0243/2010 , Vital Moreira) (vote)	16
Explanations of vote	38724
Extension of scope of regulation on the professional cross-border transportation of euro cash by road between euro area Member States (A7-0077/2011 - Sophie Auconie) (vote)	12
External dimension of social policy (short presentation)	24
Falsified medicinal products (debate)	70
Famine in East Africa (B7-0490/2011 ) (vote)	2
Famine in East Africa (debate)	88
Female poverty (A7-0031/2011 , Rovana Plumb) (vote)	2
Female poverty - Equality between women and men - 2010 (debate)	154
Financial rules applicable to the annual budget (A7-0325/2011 - Ingeborg Gräßle, Crescenzio Rivellini) (vote)	12
Financial rules applicable to the annual budget (continuation of debate)	40
Financial rules applicable to the annual budget (debate)	4
Financial, economic and social crisis: measures and initiatives to be taken (A7-0228/2011 - Pervenche Berès) (vote)	2
Financial, economic and social crisis: measures and initiatives to be taken (continuation of debate)	22
Financial, economic and social crisis: measures and initiatives to be taken (debate)	92
Financing instrument for development cooperation (A7-0402/2011 - Gay Mitchell)	4
Financing instrument for development cooperation (short presentation)	16
Financing instrument for development cooperation - Financing instrument for the promotion of democracy and human rights worldwide (amendment of Regulation (EC) No 1889/2006) - A financing instrument for development cooperation (amendment of Regulation (EC) No 1905/2006) - Establishment of a financing instrument for cooperation with industrialised countries (amendment of Regulation (EC) No 1934/2006) (debate)	92
Financing instrument for development cooperation - banana accompanying measures (A7-0403/2011 - Charles Goerens)	6
Financing instrument for development cooperation - banana accompanying measures - Financing instrument for the promotion of democracy and human rights worldwide - Financing instrument for development cooperation - Establishment of a financing instrument for cooperation with industrialised countries (debate)	60
Food information to consumers (A7-0177/2011 - Renate Sommer) (vote)	4
Food information to consumers (debate)	102
Formal sitting - Hungary	6
Forwarding of texts adopted during the sitting: see Minutes	6
Fourth United Nations Conference on the Least Developed Countries	52
Fourth United Nations Conference on the Least Developed Countries (B7-0228/2011 ) (vote)	6
Framework Programme of the European Atomic Energy Community for nuclear research and training activities (debate)	46
Free trade agreement between the EU and the Republic of Korea (A7-0034/2011 , Robert Sturdy) (vote)	6
Free trade agreement between the EU and the Republic of Korea (debate)	56
Free trade agreement with India (debate)	68
Freedom of movement for workers within the European Union (debate)	70
Freezing and disclosure of debtors' assets in cross-border cases (A7-0147/2011 , Arlene McCarthy) (vote)	4
Fruit juices and certain similar products intended for human consumption (debate)	64
Further development of an integrated maritime policy (debate)	60
Future EU cohesion policy (short presentation)	32
Future of the European Globalisation Fund - Amendment of Regulation (EC) No 1927/2006 establishing the European Globalisation Adjustment Fund (debate)	108
Future protocol setting out the fishing opportunities and financial compensation provided for in the Fisheries Partnership Agreement between the European Union and the Kingdom of Morocco (B7-0691/2011 ) (vote)	10
Gender mainstreaming in the work of the European Parliament (short presentation)	16
General Fisheries Commission for the Mediterranean Agreement Area (debate)	34
General product safety and market surveillance (short presentation)	22
Generalised tariff preferences (debate)	30
Global economic governance (short presentation)	24
Governance and partnership in the Single Market - Single market for Europeans - Single market for enterprises and growth - Public procurement (continuation of debate)	148
Governance and partnership in the single market - Single market for Europeans - Single market for enterprises and growth - Public procurement (debate)	38
Granting and withdrawing international protection (debate)	50
Greenhouse gas emission reductions and risk of carbon leakage (A7-0219/2011 - Bas Eickhout) (vote)	4
Greenhouse gas emission reductions and risk of carbon leakage (short presentation)	42
